状态,简介,page_existence,地点,子行业,网址,TAG,时间,阶段,行业,id,公司
运营中,汇金科技是一家金融安防电子信息科技产品研发和生产公司，是目前国内第三大国产中间件供应商，其核心产品为IDP系列中间件和以此为基础开发的行业应用软件，主要应用于以银行为主的金融行业、安全生产与应急等领域。,True,广东,企业IT服务,http://www.sgsg.cc,中间件,2005年1月,成长发展期,企业服务,9072,珠海汇金科技股份有限公司
运营中,基美耀拍APP，是一款基于图像识别技术的手机客户端应用程序，用户通过扫描地铁内LED的特定图片，实现各类礼品优惠的赠送。目前主要可以刷各种即将上映电影的影票。由基美传媒打造。,True,上海,综合工具软件,https://itunes.apple.com/cn/app/ji-mei-yao-pai-jin-tian-ni/id693958507?mt=8,图片图像识别,2013年9月,初创期,工具软件,9073,上海基美文化传媒股份有限公司
运营中,极梦网是一个留学、实习服务网站，通过采集出国留学项目成功申请者的背景信息，将这些数据进行处理，以data visualization的方式呈现，基于这些数据为用户做智能定位、项目推荐等。武汉尚校园网络科技有限公司旗下网站。,True,湖北,出国留学,http://geedream.com,招聘,2014年1月,初创期,教育,9074,武汉尚校园网络科技有限公司
运营中,极梦网是一个留学、实习服务网站，通过采集出国留学项目成功申请者的背景信息，将这些数据进行处理，以data visualization的方式呈现，基于这些数据为用户做智能定位、项目推荐等。武汉尚校园网络科技有限公司旗下网站。,False,湖北,出国留学,http://geedream.com,招聘,2014年1月,初创期,教育,9075,武汉尚校园网络科技有限公司
运营中,上海宽惠网络科技是一家互联网网络解决方案服务商，提供服务器、托管等服务，覆盖中国电信、中国新联通、中国移动三大运营商以及中国教育科研网、上海科技网等资源。,True,上海,企业IT服务,http://www.khdatasolutions.com,IT基础设施,2010年5月,成长发展期,企业服务,9076,上海宽惠网络科技有限公司
运营中,上海宽惠网络科技是一家互联网网络解决方案服务商，提供服务器、托管等服务，覆盖中国电信、中国新联通、中国移动三大运营商以及中国教育科研网、上海科技网等资源。,False,上海,企业IT服务,http://www.khdatasolutions.com,IT基础设施,2010年5月,成长发展期,企业服务,9077,上海宽惠网络科技有限公司
运营中,上海宽惠网络科技是一家互联网网络解决方案服务商，提供服务器、托管等服务，覆盖中国电信、中国新联通、中国移动三大运营商以及中国教育科研网、上海科技网等资源。,False,上海,企业IT服务,http://www.khdatasolutions.com,IT基础设施,2010年5月,成长发展期,企业服务,9078,上海宽惠网络科技有限公司
运营中,鑫合汇是一个在线借贷和融资服务网站，其前身叫：云融资，中新力合股份有限公司（UPG）旗下产品。,True,浙江,贷款,https://www.xinhehui.com/,P2P借贷,2014年2月,初创期,金融,9079,中新力合股份有限公司
运营中,鑫合汇是一个在线借贷和融资服务网站，其前身叫：云融资，中新力合股份有限公司（UPG）旗下产品。,False,浙江,贷款,https://www.xinhehui.com/,P2P借贷,2014年2月,初创期,金融,9080,中新力合股份有限公司
运营中,Leho乐货（前身是：爱乐活）是一个主打小时尚和潮品乐货的电商网站，隶属于乐活在线（北京）网络技术有限公司。,True,北京,综合电商,http://www.leho.com,时尚,2014年3月,初创期,电子商务,9081,乐活在线（北京）网络技术有限公司
运营中,达内科技是一家IT培训与人才服务企业，提供中高端IT人才实训、IT人才输送、教育平台建设、软件研发等综合服务。,True,北京,职业培训,http://www.tarena.com.cn,,2002年9月,上市公司,教育,9082,达内时代科技集团有限公司
运营中,爱康国宾是一家主打体检的健康管理公司，为个人及团体提供从体检、检测、医疗、家庭医生、慢病管理、健康保险等全方位个性化服务，由爱康网和上海国宾健检联合组建。,True,北京,健康管理,http://www.ikang.com,体检,2004年2月,上市公司,医疗健康,9083,北京爱康在线科技有限公司
运营中,AI.FRAME是一家人形机器人制造商，产品是一种多自由度、由微型舵机控制的类人形机器人，不仅能完成诸如跑跳、舞蹈等动作，更能进行群体互动例如踢球、摔跤搏击等。,True,广东,机器人,http://aiframe.me,,2014年1月,初创期,硬件,9084,
运营中,武汉灏信是一家征信、信用信息服务商，主要为电商平台提供供应商资质审质认证及质量认证服务。,True,湖北,信用及征信,http://www.haotion.com,数据服务,2011年9月,初创期,金融,9085,武汉灏信信息技术服务有限公司
运营中,北京江南天安科技是一家面向企业的信息安全服务提供商，提供安全体系建设、安全解决方案、国产密码产品、PKI/CA应用安全、金融IC卡应用安全、安全产品集成等服务。,True,北京,企业IT服务,http://www.tass.com.cn,安全,2005年2月,成长发展期,企业服务,9086,北京江南天安科技有限公司
运营中,福州瑞芯微电子（RockChip）是一家移动互联网及数字多媒体芯片设计、集成电路服务商，目前产品涵盖Android平板电脑、Android电视机顶盒（智能电视）、电子书、WIFI/蓝牙音频解决方案等。,True,福建,芯片半导体,http://www.rock-chips.com,,2001年1月,成长发展期,硬件,9087,福州瑞芯微电子有限公司
运营中,客赞网是一个主打当地人社交旅游的服务网站，通过网站对接旅游者和当地人，提供个性化的旅游体验，隶属于桂林城世网络科技有限公司。,True,广西,交通住宿,http://www.coolzan.com,导游,2013年12月,初创期,旅游,9088,桂林城世网络科技有限公司
运营中,客赞网是一个主打当地人社交旅游的服务网站，通过网站对接旅游者和当地人，提供个性化的旅游体验，隶属于桂林城世网络科技有限公司。,False,广西,交通住宿,http://www.coolzan.com,导游,2013年12月,初创期,旅游,9089,桂林城世网络科技有限公司
运营中,坐井是一个关注互联网创业的科技媒体，隶属于北京创业旅科技有限公司。,True,北京,媒体,http://www.zuojing.com,创业服务,2013年7月,初创期,文化娱乐体育,9090,北京创业旅科技有限公司
运营中,多萌工作室（Kiddom Studio）是一家主打幼儿教育应用和儿童游戏的移动开发商，产品有《宝贝穿啥呀》等。,True,北京,儿童早教,http://www.kiddomstudio.com,,2013年10月,初创期,教育,9091,多萌工作室
运营中,武汉领普科技（LinpTech）是一家智能家居服务商，致力于提供基于能量收集技术的智能家居/智能楼宇的产品、基础模块和解决方案，产品包括LinBell G1无线无源门铃等。,True,湖北,智能家居,http://www.linptech.com,物联网,2009年1月,初创期,硬件,9092,武汉领普科技有限公司
运营中,微动互联是一个移动营销方案提供商，利用经营场所的免费WIFI作为网络入口，进行移动互联网营销和业务运营，以及移动广告运营。,True,湖南,整合营销传播,http://www.wedofi.com,WiFi,2014年2月,初创期,广告营销,9093,长沙微动互联信息技术有限公司
运营中,微动互联是一个移动营销方案提供商，利用经营场所的免费WIFI作为网络入口，进行移动互联网营销和业务运营，以及移动广告运营。,False,湖南,整合营销传播,http://www.wedofi.com,WiFi,2014年2月,初创期,广告营销,9094,长沙微动互联信息技术有限公司
运营中,免商店前身是蜗牛商店，致力于为广大手游用户提供免费流量下载、畅玩不同主题与类型的手机游戏。,True,江苏,游戏发行及渠道,http://app.snail.com,,2014年3月,成长发展期,游戏,9095,苏州蜗牛数字科技股份有限公司
运营中,欧瑞博（ORVIBO）是一家专注于物联网、智能家居、智能硬件的技术公司，产品包括面向个人消费的微智能（WiWo）产品线、基于ZigBee无线技术的别墅豪宅智能化（ViHome）产品线、基于TCP/IP技术的全数字可视门铃产品线、为上万个物联网终端提供智能化服务的云平台（ViCenter）。,True,广东,智能家居,http://www.orvibo.com,物联网,2008年1月,成长发展期,硬件,9096,深圳市欧瑞博电子有限公司
运营中,欧瑞博（ORVIBO）是一家专注于物联网、智能家居、智能硬件的技术公司，产品包括面向个人消费的微智能（WiWo）产品线、基于ZigBee无线技术的别墅豪宅智能化（ViHome）产品线、基于TCP/IP技术的全数字可视门铃产品线、为上万个物联网终端提供智能化服务的云平台（ViCenter）。,False,广东,智能家居,http://www.orvibo.com,物联网,2008年1月,成长发展期,硬件,9097,深圳市欧瑞博电子有限公司
运营中,咂咂嘴美食网是一家主打零食、美食的分享、导购网站。,True,江西,生鲜食品,http://www.zazazui.com,导购,2014年3月,初创期,电子商务,9098,
运营中,币看Btckan是一个专注于比特币、莱特币等数字货币的资讯、行情监控、交易服务平台。,True,广东,虚拟货币,http://btckan.com,,2014年3月,初创期,金融,9099,
